{"accepted_count":12,"batch_id":"muestra-sim-000006","cumulative_mwh":192283,"energy_mwh":91098,"interval_count":12,"intervals":[{"dt_s":300,"meters":{"a":{"class":"dc","id":"pzem-017:1","mwh":7301},"b":{"class":"dc","id":"epever-tracer:2","mwh":7243}},"node_id":"muestra-sim-b","schema_version":"1.1.0","seq":73,"site_id":"muestra-sim","source":{"adapter":"simulator","raw_sha256":"20a36ba3a5f92d16de65378fffadb93ba6ef00033b97e8c564d9164023edd33e"},"spec_version":"1.0.0","ts_end":"2026-09-20T15:05:00.000Z","ts_start":"2026-09-20T15:00:00.000Z"},{"dt_s":300,"meters":{"a":{"class":"dc","id":"pzem-017:1","mwh":7379},"b":{"class":"dc","id":"epever-tracer:2","mwh":7320}},"node_id":"muestra-sim-b","schema_version":"1.1.0","seq":74,"site_id":"muestra-sim","source":{"adapter":"simulator","raw_sha256":"25f1d62e1706eedd7c5ba6907978d1a19941052b73601cad38392eed858a33ba"},"spec_version":"1.0.0","ts_end":"2026-09-20T15:10:00.000Z","ts_start":"2026-09-20T15:05:00.000Z"},{"dt_s":300,"meters":{"a":{"class":"dc","id":"pzem-017:1","mwh":7452},"b":{"class":"dc","id":"epever-tracer:2","mwh":7393}},"node_id":"muestra-sim-b","schema_version":"1.1.0","seq":75,"site_id":"muestra-sim","source":{"adapter":"simulator","raw_sha256":"cdea0933b98d734a55426d97b202d2cdc44553b0105b78a6da0e81dfb78e1a17"},"spec_version":"1.0.0","ts_end":"2026-09-20T15:15:00.000Z","ts_start":"2026-09-20T15:10:00.000Z"},{"dt_s":300,"meters":{"a":{"class":"dc","id":"pzem-017:1","mwh":7522},"b":{"class":"dc","id":"epever-tracer:2","mwh":7462}},"node_id":"muestra-sim-b","schema_version":"1.1.0","seq":76,"site_id":"muestra-sim","source":{"adapter":"simulator","raw_sha256":"b02fd7196004e23d93191f605d09c89c8d5c55540b5821c6c06a69d4f427810b"},"spec_version":"1.0.0","ts_end":"2026-09-20T15:20:00.000Z","ts_start":"2026-09-20T15:15:00.000Z"},{"dt_s":300,"meters":{"a":{"class":"dc","id":"pzem-017:1","mwh":7587},"b":{"class":"dc","id":"epever-tracer:2","mwh":7527}},"node_id":"muestra-sim-b","schema_version":"1.1.0","seq":77,"site_id":"muestra-sim","source":{"adapter":"simulator","raw_sha256":"db49474dcf8e9bf15d2626857ed69d1adce1ce281e9bd7af2819929322fd25a1"},"spec_version":"1.0.0","ts_end":"2026-09-20T15:25:00.000Z","ts_start":"2026-09-20T15:20:00.000Z"},{"dt_s":300,"meters":{"a":{"class":"dc","id":"pzem-017:1","mwh":7648},"b":{"class":"dc","id":"epever-tracer:2","mwh":7587}},"node_id":"muestra-sim-b","schema_version":"1.1.0","seq":78,"site_id":"muestra-sim","source":{"adapter":"simulator","raw_sha256":"c2f70d16f27d0bdb578a46b5f4a6f016d64116a3cc89fa99edc920b2b2bbf57f"},"spec_version":"1.0.0","ts_end":"2026-09-20T15:30:00.000Z","ts_start":"2026-09-20T15:25:00.000Z"},{"dt_s":300,"meters":{"a":{"class":"dc","id":"pzem-017:1","mwh":7705},"b":{"class":"dc","id":"epever-tracer:2","mwh":7644}},"node_id":"muestra-sim-b","schema_version":"1.1.0","seq":79,"site_id":"muestra-sim","source":{"adapter":"simulator","raw_sha256":"1ef92987c281be6c422c9aea6cdee094c579a57eb7f8702e2baf0a7cd57c3ea7"},"spec_version":"1.0.0","ts_end":"2026-09-20T15:35:00.000Z","ts_start":"2026-09-20T15:30:00.000Z"},{"dt_s":300,"meters":{"a":{"class":"dc","id":"pzem-017:1","mwh":7758},"b":{"class":"dc","id":"epever-tracer:2","mwh":7696}},"node_id":"muestra-sim-b","schema_version":"1.1.0","seq":80,"site_id":"muestra-sim","source":{"adapter":"simulator","raw_sha256":"355df52e61b6af95099f207acf447e60b0764c243f551c811615f51f3eca7a72"},"spec_version":"1.0.0","ts_end":"2026-09-20T15:40:00.000Z","ts_start":"2026-09-20T15:35:00.000Z"},{"dt_s":300,"meters":{"a":{"class":"dc","id":"pzem-017:1","mwh":7807},"b":{"class":"dc","id":"epever-tracer:2","mwh":7745}},"node_id":"muestra-sim-b","schema_version":"1.1.0","seq":81,"site_id":"muestra-sim","source":{"adapter":"simulator","raw_sha256":"15b4394fb7ae92719a6d1386be1387bb518748cfa251db5e4150dc255003ea02"},"spec_version":"1.0.0","ts_end":"2026-09-20T15:45:00.000Z","ts_start":"2026-09-20T15:40:00.000Z"},{"dt_s":300,"meters":{"a":{"class":"dc","id":"pzem-017:1","mwh":7851},"b":{"class":"dc","id":"epever-tracer:2","mwh":7789}},"node_id":"muestra-sim-b","schema_version":"1.1.0","seq":82,"site_id":"muestra-sim","source":{"adapter":"simulator","raw_sha256":"bc783f8290551cc477969df0a259ae6aa8c229c7119d329a6b624bd32cef707f"},"spec_version":"1.0.0","ts_end":"2026-09-20T15:50:00.000Z","ts_start":"2026-09-20T15:45:00.000Z"},{"dt_s":300,"meters":{"a":{"class":"dc","id":"pzem-017:1","mwh":7891},"b":{"class":"dc","id":"epever-tracer:2","mwh":7828}},"node_id":"muestra-sim-b","schema_version":"1.1.0","seq":83,"site_id":"muestra-sim","source":{"adapter":"simulator","raw_sha256":"5ddd594cbd960e9b9af0d2d020d2f4905c8996b3c469bc68629ee1b9ba845f8b"},"spec_version":"1.0.0","ts_end":"2026-09-20T15:55:00.000Z","ts_start":"2026-09-20T15:50:00.000Z"},{"dt_s":300,"meters":{"a":{"class":"dc","id":"pzem-017:1","mwh":7927},"b":{"class":"dc","id":"epever-tracer:2","mwh":7864}},"node_id":"muestra-sim-b","schema_version":"1.1.0","seq":84,"site_id":"muestra-sim","source":{"adapter":"simulator","raw_sha256":"8bc01c9648ac99965668aa2a4a9c2d688b12e340673c533da7cc0042a3bb1ae5"},"spec_version":"1.0.0","ts_end":"2026-09-20T16:00:00.000Z","ts_start":"2026-09-20T15:55:00.000Z"}],"intervals_root":"307b94e07d77ec44e881d6432f4c8b6bd3e17b5d0c356a5c0d5243bcf651ba91","node_id":"muestra-sim-b","prev_hash":"2365de2262acb3d1ec17cc4ed43f4ce134df2189daabcf09a3516081717c0dc5","rejected_count":0,"schema_version":"1.1.0","seq":6,"sha256":"0feb12bd92adf1485703e3693b0d3880324d44a924e17635d98ab4ec890a6a3e","site_id":"muestra-sim","spec_version":"1.0.0","ts_end":"2026-09-20T16:00:00.000Z","ts_start":"2026-09-20T15:00:00.000Z"}
