{"accepted_count":11,"batch_id":"muestra-sim-000004","cumulative_mwh":112720,"energy_mwh":56710,"interval_count":12,"intervals":[{"dt_s":300,"meters":{"a":{"class":"dc","id":"pzem-017:1","mwh":4430},"b":{"class":"dc","id":"epever-tracer:2","mwh":4394}},"node_id":"muestra-sim-a","schema_version":"1.1.0","seq":49,"site_id":"muestra-sim","source":{"adapter":"simulator","raw_sha256":"fe1c31ca60e7e98ab84501dce6d95c6bb32769ef75df15daf18bc56595a06554"},"spec_version":"1.0.0","ts_end":"2026-09-20T13:05:00.000Z","ts_start":"2026-09-20T13:00:00.000Z"},{"dt_s":300,"meters":{"a":{"class":"dc","id":"pzem-017:1","mwh":4580},"b":{"class":"dc","id":"epever-tracer:2","mwh":4544}},"node_id":"muestra-sim-a","schema_version":"1.1.0","seq":50,"site_id":"muestra-sim","source":{"adapter":"simulator","raw_sha256":"4f2f75945bb3b42ba0a93c854fbc3084a21352bbad5aaec045974d72775eca27"},"spec_version":"1.0.0","ts_end":"2026-09-20T13:10:00.000Z","ts_start":"2026-09-20T13:05:00.000Z"},{"dt_s":300,"meters":{"a":{"class":"dc","id":"pzem-017:1","mwh":4728},"b":{"class":"dc","id":"epever-tracer:2","mwh":4691}},"node_id":"muestra-sim-a","schema_version":"1.1.0","seq":51,"site_id":"muestra-sim","source":{"adapter":"simulator","raw_sha256":"1c3281333417a388f9eb3cc75d5d130f561aaab0aca352de556c2318f4740d83"},"spec_version":"1.0.0","ts_end":"2026-09-20T13:15:00.000Z","ts_start":"2026-09-20T13:10:00.000Z"},{"dt_s":300,"meters":{"a":{"class":"dc","id":"pzem-017:1","mwh":4875},"b":{"class":"dc","id":"epever-tracer:2","mwh":4836}},"node_id":"muestra-sim-a","schema_version":"1.1.0","seq":52,"site_id":"muestra-sim","source":{"adapter":"simulator","raw_sha256":"a047f703b2900194efa4830ac9acaf93b9641f08d2b96624100f1512265ac456"},"spec_version":"1.0.0","ts_end":"2026-09-20T13:20:00.000Z","ts_start":"2026-09-20T13:15:00.000Z"},{"dt_s":300,"meters":{"a":{"class":"dc","id":"pzem-017:1","mwh":5019},"b":{"class":"dc","id":"epever-tracer:2","mwh":4979}},"node_id":"muestra-sim-a","schema_version":"1.1.0","seq":53,"site_id":"muestra-sim","source":{"adapter":"simulator","raw_sha256":"aec8ef56df02a15123d04dbc09fc36c74f52a419550230016c27703f275deda3"},"spec_version":"1.0.0","ts_end":"2026-09-20T13:25:00.000Z","ts_start":"2026-09-20T13:20:00.000Z"},{"dt_s":300,"meters":{"a":{"class":"dc","id":"pzem-017:1","mwh":5161},"b":{"class":"dc","id":"epever-tracer:2","mwh":5120}},"node_id":"muestra-sim-a","schema_version":"1.1.0","seq":54,"site_id":"muestra-sim","source":{"adapter":"simulator","raw_sha256":"c34e5cd83be6915210e2ed3d06fa563952759e0a0cb34b950c88ce3a2af99508"},"spec_version":"1.0.0","ts_end":"2026-09-20T13:30:00.000Z","ts_start":"2026-09-20T13:25:00.000Z"},{"dt_s":300,"meters":{"a":{"class":"dc","id":"pzem-017:1","mwh":5301},"b":{"class":"dc","id":"epever-tracer:2","mwh":5259}},"node_id":"muestra-sim-a","schema_version":"1.1.0","seq":55,"site_id":"muestra-sim","source":{"adapter":"simulator","raw_sha256":"7e039700565b850df180a13e435e7599db7bf1e5a33a5e78b3d7e7831828f201"},"spec_version":"1.0.0","ts_end":"2026-09-20T13:35:00.000Z","ts_start":"2026-09-20T13:30:00.000Z"},{"dt_s":300,"meters":{"a":{"class":"dc","id":"pzem-017:1","mwh":5573},"b":{"class":"dc","id":"epever-tracer:2","mwh":5528}},"node_id":"muestra-sim-a","schema_version":"1.1.0","seq":57,"site_id":"muestra-sim","source":{"adapter":"simulator","raw_sha256":"6d45ac8520139bc2145eb51af942088a797e6692c5026100d265c9e72af99d8b"},"spec_version":"1.0.0","ts_end":"2026-09-20T13:45:00.000Z","ts_start":"2026-09-20T13:40:00.000Z"},{"dt_s":300,"meters":{"a":{"class":"dc","id":"pzem-017:1","mwh":5705},"b":{"class":"dc","id":"epever-tracer:2","mwh":5659}},"node_id":"muestra-sim-a","schema_version":"1.1.0","seq":58,"site_id":"muestra-sim","source":{"adapter":"simulator","raw_sha256":"c57d35f38c87fc7053baab3bc571f97de90c816c3c0cdb34f352b81407c7e726"},"spec_version":"1.0.0","ts_end":"2026-09-20T13:50:00.000Z","ts_start":"2026-09-20T13:45:00.000Z"},{"dt_s":300,"meters":{"a":{"class":"dc","id":"pzem-017:1","mwh":5834},"b":{"class":"dc","id":"epever-tracer:2","mwh":5787}},"node_id":"muestra-sim-a","schema_version":"1.1.0","seq":59,"site_id":"muestra-sim","source":{"adapter":"simulator","raw_sha256":"3b6e7d90d8fb9b1c69b1f0b4f27b1707e7c3470cb345a6aa2ce5e7cb69bf2b23"},"spec_version":"1.0.0","ts_end":"2026-09-20T13:55:00.000Z","ts_start":"2026-09-20T13:50:00.000Z"},{"dt_s":300,"meters":{"a":{"class":"dc","id":"pzem-017:1","mwh":5960},"b":{"class":"dc","id":"epever-tracer:2","mwh":5913}},"node_id":"muestra-sim-a","schema_version":"1.1.0","seq":60,"site_id":"muestra-sim","source":{"adapter":"simulator","raw_sha256":"70844950e3c8fbeae88374d45829053ff3d6430b7c660147be37f9d139a86cbb"},"spec_version":"1.0.0","ts_end":"2026-09-20T14:00:00.000Z","ts_start":"2026-09-20T13:55:00.000Z"}],"intervals_root":"57cb9de2c3e05f7a902119600ed37c15d8d9892a3fa1a62a2c3941fcbaa3169d","node_id":"muestra-sim-a","prev_hash":"93b5049deb9de6bd20e47051df5f3ef762842cdbd46053f040be666cdb3435cb","rejected_count":1,"schema_version":"1.1.0","seq":4,"sha256":"df4cd36db7fe9659e7fdd0360aedb1f871a1f69857711dbe70dd1e7548ed6e80","site_id":"muestra-sim","spec_version":"1.0.0","ts_end":"2026-09-20T14:00:00.000Z","ts_start":"2026-09-20T13:00:00.000Z"}
