{"accepted_count":12,"batch_id":"rehearsal-000001","cumulative_mwh":198000,"energy_mwh":99000,"interval_count":12,"intervals":[{"dt_s":300,"meters":{"a":{"class":"dc","id":"pzem-017:1","mw_mean":100000,"mwh":8333,"samples":30},"b":{"class":"dc","id":"epever-tracer:2","mw_mean":99000,"mwh":8250,"samples":30}},"node_id":"rehearsal","schema_version":"1.1.0","seq":12,"site_id":"rehearsal","source":{"adapter":"simulator","raw_sha256":"a698bb95e7259ce93d61b4fbbb8db7c4a92f30e5fa0d1af8b1258221f769fd86"},"spec_version":"1.0.0","ts_end":"2026-09-20T16:05:00.000Z","ts_start":"2026-09-20T16:00:00.000Z"},{"dt_s":300,"meters":{"a":{"class":"dc","id":"pzem-017:1","mw_mean":100000,"mwh":8333,"samples":30},"b":{"class":"dc","id":"epever-tracer:2","mw_mean":99000,"mwh":8250,"samples":30}},"node_id":"rehearsal","schema_version":"1.1.0","seq":13,"site_id":"rehearsal","source":{"adapter":"simulator","raw_sha256":"f4b060b64c7a5f69e0fca8f401d771f87abf4b220390a0ddc8382871cbc1305c"},"spec_version":"1.0.0","ts_end":"2026-09-20T16:10:00.000Z","ts_start":"2026-09-20T16:05:00.000Z"},{"dt_s":300,"meters":{"a":{"class":"dc","id":"pzem-017:1","mw_mean":100000,"mwh":8333,"samples":30},"b":{"class":"dc","id":"epever-tracer:2","mw_mean":99000,"mwh":8250,"samples":30}},"node_id":"rehearsal","schema_version":"1.1.0","seq":14,"site_id":"rehearsal","source":{"adapter":"simulator","raw_sha256":"69c8680291ab857548bb6d7dcc1ad8f917ebcb8c8813e698a506f0931f9544b6"},"spec_version":"1.0.0","ts_end":"2026-09-20T16:15:00.000Z","ts_start":"2026-09-20T16:10:00.000Z"},{"dt_s":300,"meters":{"a":{"class":"dc","id":"pzem-017:1","mw_mean":100000,"mwh":8333,"samples":30},"b":{"class":"dc","id":"epever-tracer:2","mw_mean":99000,"mwh":8250,"samples":30}},"node_id":"rehearsal","schema_version":"1.1.0","seq":15,"site_id":"rehearsal","source":{"adapter":"simulator","raw_sha256":"e7b744830602d3404dd53300a2418b5fb2a627ec7e9cbef712db3855184c05ba"},"spec_version":"1.0.0","ts_end":"2026-09-20T16:20:00.000Z","ts_start":"2026-09-20T16:15:00.000Z"},{"dt_s":300,"meters":{"a":{"class":"dc","id":"pzem-017:1","mw_mean":100000,"mwh":8333,"samples":30},"b":{"class":"dc","id":"epever-tracer:2","mw_mean":99000,"mwh":8250,"samples":30}},"node_id":"rehearsal","schema_version":"1.1.0","seq":16,"site_id":"rehearsal","source":{"adapter":"simulator","raw_sha256":"f9dee53358450b2a5f9d90d76470d9537a60c208162344ffe8d596fbfbfc04b4"},"spec_version":"1.0.0","ts_end":"2026-09-20T16:25:00.000Z","ts_start":"2026-09-20T16:20:00.000Z"},{"dt_s":300,"meters":{"a":{"class":"dc","id":"pzem-017:1","mw_mean":100000,"mwh":8333,"samples":30},"b":{"class":"dc","id":"epever-tracer:2","mw_mean":99000,"mwh":8250,"samples":30}},"node_id":"rehearsal","schema_version":"1.1.0","seq":17,"site_id":"rehearsal","source":{"adapter":"simulator","raw_sha256":"deb689401377262921bf1c41672cbe05f6bdc096ab10c0cffbea7ceaedf9c32d"},"spec_version":"1.0.0","ts_end":"2026-09-20T16:30:00.000Z","ts_start":"2026-09-20T16:25:00.000Z"},{"dt_s":300,"meters":{"a":{"class":"dc","id":"pzem-017:1","mw_mean":100000,"mwh":8333,"samples":30},"b":{"class":"dc","id":"epever-tracer:2","mw_mean":99000,"mwh":8250,"samples":30}},"node_id":"rehearsal","schema_version":"1.1.0","seq":18,"site_id":"rehearsal","source":{"adapter":"simulator","raw_sha256":"47b4d3bb259265f0c6d122899990c2d8363213692836e10ad216bb279a9b8711"},"spec_version":"1.0.0","ts_end":"2026-09-20T16:35:00.000Z","ts_start":"2026-09-20T16:30:00.000Z"},{"dt_s":300,"meters":{"a":{"class":"dc","id":"pzem-017:1","mw_mean":100000,"mwh":8333,"samples":30},"b":{"class":"dc","id":"epever-tracer:2","mw_mean":99000,"mwh":8250,"samples":30}},"node_id":"rehearsal","schema_version":"1.1.0","seq":19,"site_id":"rehearsal","source":{"adapter":"simulator","raw_sha256":"98a6ea68741f0ab41854dae8c5ffb2fd1ac8b67c0a1bc0ee576ce5273782c0f4"},"spec_version":"1.0.0","ts_end":"2026-09-20T16:40:00.000Z","ts_start":"2026-09-20T16:35:00.000Z"},{"dt_s":300,"meters":{"a":{"class":"dc","id":"pzem-017:1","mw_mean":100000,"mwh":8333,"samples":30},"b":{"class":"dc","id":"epever-tracer:2","mw_mean":99000,"mwh":8250,"samples":30}},"node_id":"rehearsal","schema_version":"1.1.0","seq":20,"site_id":"rehearsal","source":{"adapter":"simulator","raw_sha256":"20ea4032ade3cf458aa610a1d2d9dffa5553f2d5aabab1c9f563aa2872d443cb"},"spec_version":"1.0.0","ts_end":"2026-09-20T16:45:00.000Z","ts_start":"2026-09-20T16:40:00.000Z"},{"dt_s":300,"meters":{"a":{"class":"dc","id":"pzem-017:1","mw_mean":100000,"mwh":8333,"samples":30},"b":{"class":"dc","id":"epever-tracer:2","mw_mean":99000,"mwh":8250,"samples":30}},"node_id":"rehearsal","schema_version":"1.1.0","seq":21,"site_id":"rehearsal","source":{"adapter":"simulator","raw_sha256":"71a8d5209ebc41e33c1733b459112b02bcf2146446774b70e03d02e0abd3e66e"},"spec_version":"1.0.0","ts_end":"2026-09-20T16:50:00.000Z","ts_start":"2026-09-20T16:45:00.000Z"},{"dt_s":300,"meters":{"a":{"class":"dc","id":"pzem-017:1","mw_mean":100000,"mwh":8333,"samples":30},"b":{"class":"dc","id":"epever-tracer:2","mw_mean":99000,"mwh":8250,"samples":30}},"node_id":"rehearsal","schema_version":"1.1.0","seq":22,"site_id":"rehearsal","source":{"adapter":"simulator","raw_sha256":"20eb523a276138c36572d83b12ed94f13e6896ed4d1bb83a0712e3edb437e75f"},"spec_version":"1.0.0","ts_end":"2026-09-20T16:55:00.000Z","ts_start":"2026-09-20T16:50:00.000Z"},{"dt_s":300,"meters":{"a":{"class":"dc","id":"pzem-017:1","mw_mean":100000,"mwh":8333,"samples":30},"b":{"class":"dc","id":"epever-tracer:2","mw_mean":99000,"mwh":8250,"samples":30}},"node_id":"rehearsal","schema_version":"1.1.0","seq":23,"site_id":"rehearsal","source":{"adapter":"simulator","raw_sha256":"095ef068ae173efff1ce2ca3ae3a1c0ffb220ef3ce54577ef40cc40caf9f1777"},"spec_version":"1.0.0","ts_end":"2026-09-20T17:00:00.000Z","ts_start":"2026-09-20T16:55:00.000Z"}],"intervals_root":"12525249374ae8cf7612482b5b105e48d07e9b05a1e391f7ffb4de75ade003a1","node_id":"rehearsal","prev_hash":"322923a411c146079b73269fe3135d9e6413a9dafdb07807567c8a119f35a245","rejected_count":0,"schema_version":"1.1.0","seq":1,"sha256":"852314a2a11f86548e3f8b09c16aa2fd6ef82ae8e8641db5ef20a4bc2d0f5466","site_id":"rehearsal","spec_version":"1.0.0","ts_end":"2026-09-20T17:00:00.000Z","ts_start":"2026-09-20T16:00:00.000Z"}
