{"accepted_count":12,"batch_id":"muestra-sim-000002","cumulative_mwh":18741,"energy_mwh":17613,"interval_count":13,"intervals":[{"dt_s":300,"meters":{"a":{"class":"dc","id":"pzem-017:1","mwh":627},"b":{"class":"dc","id":"epever-tracer:2","mwh":622}},"node_id":"muestra-sim-a","schema_version":"1.1.0","seq":24,"site_id":"muestra-sim","source":{"adapter":"simulator","raw_sha256":"cfb72c0a588d50480c03e487b7f4ddd160a610d935023c02d830ab8449d0b2dd"},"spec_version":"1.0.0","ts_end":"2026-09-20T11:05:00.000Z","ts_start":"2026-09-20T11:00:00.000Z"},{"dt_s":300,"meters":{"a":{"class":"dc","id":"pzem-017:1","mwh":775},"b":{"class":"dc","id":"epever-tracer:2","mwh":768}},"node_id":"muestra-sim-a","schema_version":"1.1.0","seq":25,"site_id":"muestra-sim","source":{"adapter":"simulator","raw_sha256":"36159a3148de83240394020faab6075c42da4f9ae45cdab08108f0a9bc3acf3d"},"spec_version":"1.0.0","ts_end":"2026-09-20T11:10:00.000Z","ts_start":"2026-09-20T11:05:00.000Z"},{"dt_s":300,"meters":{"a":{"class":"dc","id":"pzem-017:1","mwh":925},"b":{"class":"dc","id":"epever-tracer:2","mwh":918}},"node_id":"muestra-sim-a","schema_version":"1.1.0","seq":26,"site_id":"muestra-sim","source":{"adapter":"simulator","raw_sha256":"b69611b66f86a097afbc23b5b18a5001b9324c09d2db400c532179f5de556303"},"spec_version":"1.0.0","ts_end":"2026-09-20T11:15:00.000Z","ts_start":"2026-09-20T11:10:00.000Z"},{"dt_s":300,"meters":{"a":{"class":"dc","id":"pzem-017:1","mwh":1079},"b":{"class":"dc","id":"epever-tracer:2","mwh":1070}},"node_id":"muestra-sim-a","schema_version":"1.1.0","seq":27,"site_id":"muestra-sim","source":{"adapter":"simulator","raw_sha256":"7c1d4332c2c180352f44fdbce1cc86a1c1221f38a879227abc05ff1d84f7ba7f"},"spec_version":"1.0.0","ts_end":"2026-09-20T11:20:00.000Z","ts_start":"2026-09-20T11:15:00.000Z"},{"dt_s":300,"meters":{"a":{"class":"dc","id":"pzem-017:1","mwh":1234},"b":{"class":"dc","id":"epever-tracer:2","mwh":1224}},"node_id":"muestra-sim-a","schema_version":"1.1.0","seq":29,"site_id":"muestra-sim","source":{"adapter":"simulator","raw_sha256":"850f842d536904bbea0ef471db462e06199c6257938daa39f5cfa14552b2cc4c"},"spec_version":"1.0.0","ts_end":"2026-09-20T11:25:00.000Z","ts_start":"2026-09-20T11:20:00.000Z"},{"dt_s":300,"meters":{"a":{"class":"dc","id":"pzem-017:1","mwh":1392},"b":{"class":"dc","id":"epever-tracer:2","mwh":1381}},"node_id":"muestra-sim-a","schema_version":"1.1.0","seq":30,"site_id":"muestra-sim","source":{"adapter":"simulator","raw_sha256":"6df4cdf04f11c1a6f809478857fdab2f1310b00ef9a5b4e9cae087a9ae9d80bf"},"spec_version":"1.0.0","ts_end":"2026-09-20T11:30:00.000Z","ts_start":"2026-09-20T11:25:00.000Z"},{"dt_s":300,"meters":{"a":{"class":"dc","id":"pzem-017:1","mwh":1551},"b":{"class":"dc","id":"epever-tracer:2","mwh":1538}},"node_id":"muestra-sim-a","schema_version":"1.1.0","seq":31,"site_id":"muestra-sim","source":{"adapter":"simulator","raw_sha256":"932cbdeb9aafb5e313b3eb26869aeb93fad9c6b7aebe6b9328cd82b9bfa3ffdc"},"spec_version":"1.0.0","ts_end":"2026-09-20T11:35:00.000Z","ts_start":"2026-09-20T11:30:00.000Z"},{"dt_s":300,"meters":{"a":{"class":"dc","id":"pzem-017:1","mwh":1711},"b":{"class":"dc","id":"epever-tracer:2","mwh":1697}},"node_id":"muestra-sim-a","schema_version":"1.1.0","seq":32,"site_id":"muestra-sim","source":{"adapter":"simulator","raw_sha256":"4a4e6221f1a83d2d15a502085dbbc1ead4d9181b66e1dcc718d60a04809749d4"},"spec_version":"1.0.0","ts_end":"2026-09-20T11:40:00.000Z","ts_start":"2026-09-20T11:35:00.000Z"},{"dt_s":300,"meters":{"a":{"class":"dc","id":"pzem-017:1","mwh":1872},"b":{"class":"dc","id":"epever-tracer:2","mwh":1857}},"node_id":"muestra-sim-a","schema_version":"1.1.0","seq":33,"site_id":"muestra-sim","source":{"adapter":"simulator","raw_sha256":"dd5ba1d27d4d1f0b51ecb9ed08f953f89dafccd5bac70b0e8f63e0485853c9ce"},"spec_version":"1.0.0","ts_end":"2026-09-20T11:45:00.000Z","ts_start":"2026-09-20T11:40:00.000Z"},{"dt_s":300,"meters":{"a":{"class":"dc","id":"pzem-017:1","mwh":2034},"b":{"class":"dc","id":"epever-tracer:2","mwh":2018}},"node_id":"muestra-sim-a","schema_version":"1.1.0","seq":34,"site_id":"muestra-sim","source":{"adapter":"simulator","raw_sha256":"f2d4f97aac953296618d91509abc36a0eb504b3da0502a13f2e1c42458a36b0d"},"spec_version":"1.0.0","ts_end":"2026-09-20T11:50:00.000Z","ts_start":"2026-09-20T11:45:00.000Z"},{"dt_s":300,"meters":{"a":{"class":"dc","id":"pzem-017:1","mwh":2197},"b":{"class":"dc","id":"epever-tracer:2","mwh":2179}},"node_id":"muestra-sim-a","schema_version":"1.1.0","seq":35,"site_id":"muestra-sim","source":{"adapter":"simulator","raw_sha256":"f9d55e4a426469d880e9bae1a2c24fd3d68723cfe9f20d877becdffe0de3ced2"},"spec_version":"1.0.0","ts_end":"2026-09-20T11:55:00.000Z","ts_start":"2026-09-20T11:50:00.000Z"},{"dt_s":300,"meters":{"a":{"class":"dc","id":"pzem-017:1","mwh":2360},"b":{"class":"dc","id":"epever-tracer:2","mwh":2341}},"node_id":"muestra-sim-a","schema_version":"1.1.0","seq":36,"site_id":"muestra-sim","source":{"adapter":"simulator","raw_sha256":"e67409b79ceac7bf00906a574d093efaca207b04571ed77ed88231a4aba5a34e"},"spec_version":"1.0.0","ts_end":"2026-09-20T12:00:00.000Z","ts_start":"2026-09-20T11:55:00.000Z"}],"intervals_root":"45972289eda67538396b26e23df1e6ce98306909ad78b816862e16ab891d3857","node_id":"muestra-sim-a","prev_hash":"8fcb67d4d3bb15f97f302abc22ed054cf33684807d3b9e8373b117265788b593","rejected_count":1,"schema_version":"1.1.0","seq":2,"sha256":"b4bec36e48d429040a5d8557d38c68627d5e3088903c39359f624802be8b33ae","site_id":"muestra-sim","spec_version":"1.0.0","ts_end":"2026-09-20T12:00:00.000Z","ts_start":"2026-09-20T11:00:00.000Z"}
