{"accepted_count":12,"batch_id":"rehearsal-000000","cumulative_mwh":99000,"energy_mwh":99000,"interval_count":12,"intervals":[{"dt_s":300,"meters":{"a":{"class":"dc","id":"pzem-017:1","mw_mean":100000,"mwh":8333,"samples":30},"b":{"class":"dc","id":"epever-tracer:2","mw_mean":99000,"mwh":8250,"samples":30}},"node_id":"rehearsal","schema_version":"1.1.0","seq":0,"site_id":"rehearsal","source":{"adapter":"simulator","raw_sha256":"f5ad6f66f8ba5b419d8ef1cf872aeb34ebc1577b660e5a8c66d9faadb10cba63"},"spec_version":"1.0.0","ts_end":"2026-09-20T15:05:00.000Z","ts_start":"2026-09-20T15:00:00.000Z"},{"dt_s":300,"meters":{"a":{"class":"dc","id":"pzem-017:1","mw_mean":100000,"mwh":8333,"samples":30},"b":{"class":"dc","id":"epever-tracer:2","mw_mean":99000,"mwh":8250,"samples":30}},"node_id":"rehearsal","schema_version":"1.1.0","seq":1,"site_id":"rehearsal","source":{"adapter":"simulator","raw_sha256":"2a83ba96d80e7df51ec38a54e97e91ca2fa53b9582f91fb92963c65ec54f0b1d"},"spec_version":"1.0.0","ts_end":"2026-09-20T15:10:00.000Z","ts_start":"2026-09-20T15:05:00.000Z"},{"dt_s":300,"meters":{"a":{"class":"dc","id":"pzem-017:1","mw_mean":100000,"mwh":8333,"samples":30},"b":{"class":"dc","id":"epever-tracer:2","mw_mean":99000,"mwh":8250,"samples":30}},"node_id":"rehearsal","schema_version":"1.1.0","seq":2,"site_id":"rehearsal","source":{"adapter":"simulator","raw_sha256":"e4a3ccf3d612c5db03022a5f958ff0b3bca2cb686ec87fe065e824c4d2eaf740"},"spec_version":"1.0.0","ts_end":"2026-09-20T15:15:00.000Z","ts_start":"2026-09-20T15:10:00.000Z"},{"dt_s":300,"meters":{"a":{"class":"dc","id":"pzem-017:1","mw_mean":100000,"mwh":8333,"samples":30},"b":{"class":"dc","id":"epever-tracer:2","mw_mean":99000,"mwh":8250,"samples":30}},"node_id":"rehearsal","schema_version":"1.1.0","seq":3,"site_id":"rehearsal","source":{"adapter":"simulator","raw_sha256":"73cc0723f3219a97f6b8d7da765fba4404959bf19b24296498800c19de5c8063"},"spec_version":"1.0.0","ts_end":"2026-09-20T15:20:00.000Z","ts_start":"2026-09-20T15:15:00.000Z"},{"dt_s":300,"meters":{"a":{"class":"dc","id":"pzem-017:1","mw_mean":100000,"mwh":8333,"samples":30},"b":{"class":"dc","id":"epever-tracer:2","mw_mean":99000,"mwh":8250,"samples":30}},"node_id":"rehearsal","schema_version":"1.1.0","seq":4,"site_id":"rehearsal","source":{"adapter":"simulator","raw_sha256":"96bc5ba8c65540a3eabb27106a3e9481d4df264ee86fdd52e9ff367f15150bd7"},"spec_version":"1.0.0","ts_end":"2026-09-20T15:25:00.000Z","ts_start":"2026-09-20T15:20:00.000Z"},{"dt_s":300,"meters":{"a":{"class":"dc","id":"pzem-017:1","mw_mean":100000,"mwh":8333,"samples":30},"b":{"class":"dc","id":"epever-tracer:2","mw_mean":99000,"mwh":8250,"samples":30}},"node_id":"rehearsal","schema_version":"1.1.0","seq":5,"site_id":"rehearsal","source":{"adapter":"simulator","raw_sha256":"e98689fadf571ee20f939e922d3dfc49dbb76614162fda3db357fdaaa4a3a5a7"},"spec_version":"1.0.0","ts_end":"2026-09-20T15:30:00.000Z","ts_start":"2026-09-20T15:25:00.000Z"},{"dt_s":300,"meters":{"a":{"class":"dc","id":"pzem-017:1","mw_mean":100000,"mwh":8333,"samples":30},"b":{"class":"dc","id":"epever-tracer:2","mw_mean":99000,"mwh":8250,"samples":30}},"node_id":"rehearsal","schema_version":"1.1.0","seq":6,"site_id":"rehearsal","source":{"adapter":"simulator","raw_sha256":"4c5ec82b9848f50afbab22115d48efaba211a79e6f9e7115495d13adc5c7af09"},"spec_version":"1.0.0","ts_end":"2026-09-20T15:35:00.000Z","ts_start":"2026-09-20T15:30:00.000Z"},{"dt_s":300,"meters":{"a":{"class":"dc","id":"pzem-017:1","mw_mean":100000,"mwh":8333,"samples":30},"b":{"class":"dc","id":"epever-tracer:2","mw_mean":99000,"mwh":8250,"samples":30}},"node_id":"rehearsal","schema_version":"1.1.0","seq":7,"site_id":"rehearsal","source":{"adapter":"simulator","raw_sha256":"7e360e87b64283fe3538241f1dff2b5044fe0eb8a5927916216a2f06305b7e05"},"spec_version":"1.0.0","ts_end":"2026-09-20T15:40:00.000Z","ts_start":"2026-09-20T15:35:00.000Z"},{"dt_s":300,"meters":{"a":{"class":"dc","id":"pzem-017:1","mw_mean":100000,"mwh":8333,"samples":30},"b":{"class":"dc","id":"epever-tracer:2","mw_mean":99000,"mwh":8250,"samples":30}},"node_id":"rehearsal","schema_version":"1.1.0","seq":8,"site_id":"rehearsal","source":{"adapter":"simulator","raw_sha256":"2c7a0749fa646a9eaa8eff9314af994587e117c4839c5e6b0780fde9cb0a1f44"},"spec_version":"1.0.0","ts_end":"2026-09-20T15:45:00.000Z","ts_start":"2026-09-20T15:40:00.000Z"},{"dt_s":300,"meters":{"a":{"class":"dc","id":"pzem-017:1","mw_mean":100000,"mwh":8333,"samples":30},"b":{"class":"dc","id":"epever-tracer:2","mw_mean":99000,"mwh":8250,"samples":30}},"node_id":"rehearsal","schema_version":"1.1.0","seq":9,"site_id":"rehearsal","source":{"adapter":"simulator","raw_sha256":"4526770ce861e65562c1bad3d9b214e89d98fdb1e48a7df64deafb56bc0f5e2f"},"spec_version":"1.0.0","ts_end":"2026-09-20T15:50:00.000Z","ts_start":"2026-09-20T15:45:00.000Z"},{"dt_s":300,"meters":{"a":{"class":"dc","id":"pzem-017:1","mw_mean":100000,"mwh":8333,"samples":30},"b":{"class":"dc","id":"epever-tracer:2","mw_mean":99000,"mwh":8250,"samples":30}},"node_id":"rehearsal","schema_version":"1.1.0","seq":10,"site_id":"rehearsal","source":{"adapter":"simulator","raw_sha256":"f70e3c9af09e47a860c6b3d7d56f9d3bbbdd4ef1bfa89458b5a382f2026ee4ec"},"spec_version":"1.0.0","ts_end":"2026-09-20T15:55:00.000Z","ts_start":"2026-09-20T15:50:00.000Z"},{"dt_s":300,"meters":{"a":{"class":"dc","id":"pzem-017:1","mw_mean":100000,"mwh":8333,"samples":30},"b":{"class":"dc","id":"epever-tracer:2","mw_mean":99000,"mwh":8250,"samples":30}},"node_id":"rehearsal","schema_version":"1.1.0","seq":11,"site_id":"rehearsal","source":{"adapter":"simulator","raw_sha256":"92f13bd2bc241a82f0857ce003bf04cb55ba189227c320585245292d4899157f"},"spec_version":"1.0.0","ts_end":"2026-09-20T16:00:00.000Z","ts_start":"2026-09-20T15:55:00.000Z"}],"intervals_root":"94f85e6efa28e54e957ecdad4d5ce01f7ac99573ab1c1cb9bd3361451f93a5bc","node_id":"rehearsal","prev_hash":"0000000000000000000000000000000000000000000000000000000000000000","rejected_count":0,"schema_version":"1.1.0","seq":0,"sha256":"322923a411c146079b73269fe3135d9e6413a9dafdb07807567c8a119f35a245","site_id":"rehearsal","spec_version":"1.0.0","ts_end":"2026-09-20T16:00:00.000Z","ts_start":"2026-09-20T15:00:00.000Z"}
