{"accepted_count":11,"batch_id":"muestra-sim-000003","cumulative_mwh":56010,"energy_mwh":37269,"interval_count":12,"intervals":[{"dt_s":300,"meters":{"a":{"class":"dc","id":"pzem-017:1","mwh":2523},"b":{"class":"dc","id":"epever-tracer:2","mwh":2503}},"node_id":"muestra-sim-a","schema_version":"1.1.0","seq":37,"site_id":"muestra-sim","source":{"adapter":"simulator","raw_sha256":"c03c5448fd00e12a2181c9d27a7ccf215257ca90d4ad69018fa93e6ce0be64dc"},"spec_version":"1.0.0","ts_end":"2026-09-20T12:05:00.000Z","ts_start":"2026-09-20T12:00:00.000Z"},{"dt_s":300,"meters":{"a":{"class":"dc","id":"pzem-017:1","mwh":2686},"b":{"class":"dc","id":"epever-tracer:2","mwh":2664}},"node_id":"muestra-sim-a","schema_version":"1.1.0","seq":38,"site_id":"muestra-sim","source":{"adapter":"simulator","raw_sha256":"c35142c4f5b3c69c8604d7966a33cc68db96e8b70df83f4cdbe62a3fbce90cf5"},"spec_version":"1.0.0","ts_end":"2026-09-20T12:10:00.000Z","ts_start":"2026-09-20T12:05:00.000Z"},{"dt_s":300,"meters":{"a":{"class":"dc","id":"pzem-017:1","mwh":2848},"b":{"class":"dc","id":"epever-tracer:2","mwh":2826}},"node_id":"muestra-sim-a","schema_version":"1.1.0","seq":39,"site_id":"muestra-sim","source":{"adapter":"simulator","raw_sha256":"b8236941bbdd6f15d281b5aae339e06ffa97aff5c1fa1b82c3562e81cece95be"},"spec_version":"1.0.0","ts_end":"2026-09-20T12:15:00.000Z","ts_start":"2026-09-20T12:10:00.000Z"},{"dt_s":300,"meters":{"a":{"class":"dc","id":"pzem-017:1","mwh":3011},"b":{"class":"dc","id":"epever-tracer:2","mwh":2987}},"node_id":"muestra-sim-a","schema_version":"1.1.0","seq":40,"site_id":"muestra-sim","source":{"adapter":"simulator","raw_sha256":"0c580cb59b981ac5d5e30c1682f41b5fc27675e1635553058f9579c0bf1c4f8d"},"spec_version":"1.0.0","ts_end":"2026-09-20T12:20:00.000Z","ts_start":"2026-09-20T12:15:00.000Z"},{"dt_s":300,"meters":{"a":{"class":"dc","id":"pzem-017:1","mwh":3173},"b":{"class":"dc","id":"epever-tracer:2","mwh":3147}},"node_id":"muestra-sim-a","schema_version":"1.1.0","seq":41,"site_id":"muestra-sim","source":{"adapter":"simulator","raw_sha256":"539d880ba3fe901ca8a7414d986b76fb6856da0fe94d6320eba0f4fd2032a304"},"spec_version":"1.0.0","ts_end":"2026-09-20T12:25:00.000Z","ts_start":"2026-09-20T12:20:00.000Z"},{"dt_s":300,"meters":{"a":{"class":"dc","id":"pzem-017:1","mwh":3494},"b":{"class":"dc","id":"epever-tracer:2","mwh":3466}},"node_id":"muestra-sim-a","schema_version":"1.1.0","seq":43,"site_id":"muestra-sim","source":{"adapter":"simulator","raw_sha256":"36bd01f582cf4aa7ed6117662efe0f5b69e5c6b971a388b00dad72eca809ee33"},"spec_version":"1.0.0","ts_end":"2026-09-20T12:35:00.000Z","ts_start":"2026-09-20T12:30:00.000Z"},{"dt_s":300,"meters":{"a":{"class":"dc","id":"pzem-017:1","mwh":3653},"b":{"class":"dc","id":"epever-tracer:2","mwh":3624}},"node_id":"muestra-sim-a","schema_version":"1.1.0","seq":44,"site_id":"muestra-sim","source":{"adapter":"simulator","raw_sha256":"ad799cb0c042e856b3355beb6c4e102d497b98f28f6a1132a8868373829a11d0"},"spec_version":"1.0.0","ts_end":"2026-09-20T12:40:00.000Z","ts_start":"2026-09-20T12:35:00.000Z"},{"dt_s":300,"meters":{"a":{"class":"dc","id":"pzem-017:1","mwh":3811},"b":{"class":"dc","id":"epever-tracer:2","mwh":3781}},"node_id":"muestra-sim-a","schema_version":"1.1.0","seq":45,"site_id":"muestra-sim","source":{"adapter":"simulator","raw_sha256":"79db186e6bb40bc3871a04b280d2b939c032f7342b4009936f05cf819d8a3259"},"spec_version":"1.0.0","ts_end":"2026-09-20T12:45:00.000Z","ts_start":"2026-09-20T12:40:00.000Z"},{"dt_s":300,"meters":{"a":{"class":"dc","id":"pzem-017:1","mwh":3968},"b":{"class":"dc","id":"epever-tracer:2","mwh":3937}},"node_id":"muestra-sim-a","schema_version":"1.1.0","seq":46,"site_id":"muestra-sim","source":{"adapter":"simulator","raw_sha256":"968efba535be1b9b72611a008bc60bfeda507f53c1ae13233eddf248be498ab9"},"spec_version":"1.0.0","ts_end":"2026-09-20T12:50:00.000Z","ts_start":"2026-09-20T12:45:00.000Z"},{"dt_s":300,"meters":{"a":{"class":"dc","id":"pzem-017:1","mwh":4124},"b":{"class":"dc","id":"epever-tracer:2","mwh":4091}},"node_id":"muestra-sim-a","schema_version":"1.1.0","seq":47,"site_id":"muestra-sim","source":{"adapter":"simulator","raw_sha256":"bae45152e409b96d4489f3e17b150c3d8d1b02be05e93745c3d873df46b58328"},"spec_version":"1.0.0","ts_end":"2026-09-20T12:55:00.000Z","ts_start":"2026-09-20T12:50:00.000Z"},{"dt_s":300,"meters":{"a":{"class":"dc","id":"pzem-017:1","mwh":4277},"b":{"class":"dc","id":"epever-tracer:2","mwh":4243}},"node_id":"muestra-sim-a","schema_version":"1.1.0","seq":48,"site_id":"muestra-sim","source":{"adapter":"simulator","raw_sha256":"4bd21f046f403614caf20899356fb704810aaa3037d9eb361824af885a245fbc"},"spec_version":"1.0.0","ts_end":"2026-09-20T13:00:00.000Z","ts_start":"2026-09-20T12:55:00.000Z"}],"intervals_root":"cabb23e8cada8ffa4f9559a179f86782512753b5490ede910116c80551aa240f","node_id":"muestra-sim-a","prev_hash":"dc58431a238fc45dea27d3715080f2f97aab00a0dc33831368df188250ecff3d","rejected_count":1,"samples_root":"c874ba879a48a145092cc437786477d0b93a61aea2ffc0e5176a81c71a239954","schema_version":"1.1.0","seq":3,"sha256":"a5ce73683e464692e56e5ef750ec94bc8fed55c3910d66bf91167009b78393ed","site_id":"muestra-sim","spec_version":"1.0.0","ts_end":"2026-09-20T13:00:00.000Z","ts_start":"2026-09-20T12:00:00.000Z"}
