{"accepted_count":12,"batch_id":"muestra-sim-000007","cumulative_mwh":287814,"energy_mwh":95531,"interval_count":12,"intervals":[{"dt_s":300,"meters":{"a":{"class":"dc","id":"pzem-017:1","mwh":7958},"b":{"class":"dc","id":"epever-tracer:2","mwh":7895}},"node_id":"muestra-sim-a","schema_version":"1.1.0","seq":85,"site_id":"muestra-sim","source":{"adapter":"simulator","raw_sha256":"6f29db1b36444d43e36131aac293f9d84cbcec1030d36d20d1a5b23953ded3cd"},"spec_version":"1.0.0","ts_end":"2026-09-20T16:05:00.000Z","ts_start":"2026-09-20T16:00:00.000Z"},{"dt_s":300,"meters":{"a":{"class":"dc","id":"pzem-017:1","mwh":7985},"b":{"class":"dc","id":"epever-tracer:2","mwh":7921}},"node_id":"muestra-sim-a","schema_version":"1.1.0","seq":86,"site_id":"muestra-sim","source":{"adapter":"simulator","raw_sha256":"cdf1bd5c67c65946c4a4683e7e9c5eba83d42506810012d3c8694e952a4b2fdc"},"spec_version":"1.0.0","ts_end":"2026-09-20T16:10:00.000Z","ts_start":"2026-09-20T16:05:00.000Z"},{"dt_s":300,"meters":{"a":{"class":"dc","id":"pzem-017:1","mwh":8008},"b":{"class":"dc","id":"epever-tracer:2","mwh":7944}},"node_id":"muestra-sim-a","schema_version":"1.1.0","seq":87,"site_id":"muestra-sim","source":{"adapter":"simulator","raw_sha256":"60de32fbfadb791b291052c9686445da9b86915eca7bc4e117046681da33ea83"},"spec_version":"1.0.0","ts_end":"2026-09-20T16:15:00.000Z","ts_start":"2026-09-20T16:10:00.000Z"},{"dt_s":300,"meters":{"a":{"class":"dc","id":"pzem-017:1","mwh":8026},"b":{"class":"dc","id":"epever-tracer:2","mwh":7962}},"node_id":"muestra-sim-a","schema_version":"1.1.0","seq":88,"site_id":"muestra-sim","source":{"adapter":"simulator","raw_sha256":"d819583917db6f33b36330ab0d38d410aa7e002d0de0190a8ebb3d70c4a732d1"},"spec_version":"1.0.0","ts_end":"2026-09-20T16:20:00.000Z","ts_start":"2026-09-20T16:15:00.000Z"},{"dt_s":300,"meters":{"a":{"class":"dc","id":"pzem-017:1","mwh":8039},"b":{"class":"dc","id":"epever-tracer:2","mwh":7975}},"node_id":"muestra-sim-a","schema_version":"1.1.0","seq":89,"site_id":"muestra-sim","source":{"adapter":"simulator","raw_sha256":"1d836e332a7c0208a71c6e7e590620425e4196bb7befea9b87aa9626d0c62a70"},"spec_version":"1.0.0","ts_end":"2026-09-20T16:25:00.000Z","ts_start":"2026-09-20T16:20:00.000Z"},{"dt_s":300,"meters":{"a":{"class":"dc","id":"pzem-017:1","mwh":8048},"b":{"class":"dc","id":"epever-tracer:2","mwh":7984}},"node_id":"muestra-sim-a","schema_version":"1.1.0","seq":90,"site_id":"muestra-sim","source":{"adapter":"simulator","raw_sha256":"8748928bee8bb560fb57ba2b16c777243b0e65669116c3d29febe23384a5fc9f"},"spec_version":"1.0.0","ts_end":"2026-09-20T16:30:00.000Z","ts_start":"2026-09-20T16:25:00.000Z"},{"dt_s":300,"meters":{"a":{"class":"dc","id":"pzem-017:1","mwh":8053},"b":{"class":"dc","id":"epever-tracer:2","mwh":7989}},"node_id":"muestra-sim-a","schema_version":"1.1.0","seq":91,"site_id":"muestra-sim","source":{"adapter":"simulator","raw_sha256":"8696753efa85c7e55ed4cf485fe328cbc63836d766acf61ae5eda1238e7be835"},"spec_version":"1.0.0","ts_end":"2026-09-20T16:35:00.000Z","ts_start":"2026-09-20T16:30:00.000Z"},{"dt_s":300,"meters":{"a":{"class":"dc","id":"pzem-017:1","mwh":8054},"b":{"class":"dc","id":"epever-tracer:2","mwh":7989}},"node_id":"muestra-sim-a","schema_version":"1.1.0","seq":92,"site_id":"muestra-sim","source":{"adapter":"simulator","raw_sha256":"3db56211796a35a57304fb078e82bbd84d420615438eabadf0978d7f888e444f"},"spec_version":"1.0.0","ts_end":"2026-09-20T16:40:00.000Z","ts_start":"2026-09-20T16:35:00.000Z"},{"dt_s":300,"meters":{"a":{"class":"dc","id":"pzem-017:1","mwh":8049},"b":{"class":"dc","id":"epever-tracer:2","mwh":7985}},"node_id":"muestra-sim-a","schema_version":"1.1.0","seq":93,"site_id":"muestra-sim","source":{"adapter":"simulator","raw_sha256":"974d2c8c31fda99f315733b1eab3029b875f9e0e1eb84325e8a1c75cf5de8a15"},"spec_version":"1.0.0","ts_end":"2026-09-20T16:45:00.000Z","ts_start":"2026-09-20T16:40:00.000Z"},{"dt_s":300,"meters":{"a":{"class":"dc","id":"pzem-017:1","mwh":8041},"b":{"class":"dc","id":"epever-tracer:2","mwh":7977}},"node_id":"muestra-sim-a","schema_version":"1.1.0","seq":94,"site_id":"muestra-sim","source":{"adapter":"simulator","raw_sha256":"1a136d56d71c4b935f5975b0b80f6c88a779a896d276e16642753c2cbc9b2f16"},"spec_version":"1.0.0","ts_end":"2026-09-20T16:50:00.000Z","ts_start":"2026-09-20T16:45:00.000Z"},{"dt_s":300,"meters":{"a":{"class":"dc","id":"pzem-017:1","mwh":8028},"b":{"class":"dc","id":"epever-tracer:2","mwh":7964}},"node_id":"muestra-sim-a","schema_version":"1.1.0","seq":95,"site_id":"muestra-sim","source":{"adapter":"simulator","raw_sha256":"c62469d4d97ee8390e5463df67ce70bd13a2ad1c08d1416dad23f02d54836484"},"spec_version":"1.0.0","ts_end":"2026-09-20T16:55:00.000Z","ts_start":"2026-09-20T16:50:00.000Z"},{"dt_s":300,"meters":{"a":{"class":"dc","id":"pzem-017:1","mwh":8010},"b":{"class":"dc","id":"epever-tracer:2","mwh":7946}},"node_id":"muestra-sim-a","schema_version":"1.1.0","seq":96,"site_id":"muestra-sim","source":{"adapter":"simulator","raw_sha256":"4b2142f0353cb3cbd7420ab4ca8a7a678233610e5639e0b21ff96a9dbf6d56d8"},"spec_version":"1.0.0","ts_end":"2026-09-20T17:00:00.000Z","ts_start":"2026-09-20T16:55:00.000Z"}],"intervals_root":"0501a9fba9f7c7381d86a386f48b2337c8215048052b2be4dd669edbe64861b1","node_id":"muestra-sim-a","prev_hash":"0feb12bd92adf1485703e3693b0d3880324d44a924e17635d98ab4ec890a6a3e","rejected_count":0,"schema_version":"1.1.0","seq":7,"sha256":"f1f85dfaaa8e220cb454221d86a0117f3c806826f4cc02160570afd6f7d4e1dc","site_id":"muestra-sim","spec_version":"1.0.0","ts_end":"2026-09-20T17:00:00.000Z","ts_start":"2026-09-20T16:00:00.000Z"}
