{"accepted_count":11,"batch_id":"muestra-sim-000000","cumulative_mwh":0,"energy_mwh":0,"interval_count":12,"intervals":[{"dt_s":300,"meters":{"a":{"class":"dc","id":"pzem-017:1","mwh":0},"b":{"class":"dc","id":"epever-tracer:2","mwh":0}},"node_id":"muestra-sim-a","schema_version":"1.1.0","seq":0,"site_id":"muestra-sim","source":{"adapter":"simulator","raw_sha256":"b3945c2c16ec1f89fba2f8fddc4db488bd05bb491e9234d2a62c864900e3a040"},"spec_version":"1.0.0","ts_end":"2026-09-20T09:05:00.000Z","ts_start":"2026-09-20T09:00:00.000Z"},{"dt_s":300,"meters":{"a":{"class":"dc","id":"pzem-017:1","mwh":0},"b":{"class":"dc","id":"epever-tracer:2","mwh":0}},"node_id":"muestra-sim-a","schema_version":"1.1.0","seq":1,"site_id":"muestra-sim","source":{"adapter":"simulator","raw_sha256":"cdd708a030ac8967721b72ac38ddadc1e9182025ecc4718b1c84211e8d6cd263"},"spec_version":"1.0.0","ts_end":"2026-09-20T09:10:00.000Z","ts_start":"2026-09-20T09:05:00.000Z"},{"dt_s":300,"meters":{"a":{"class":"dc","id":"pzem-017:1","mwh":0},"b":{"class":"dc","id":"epever-tracer:2","mwh":0}},"node_id":"muestra-sim-a","schema_version":"1.1.0","seq":2,"site_id":"muestra-sim","source":{"adapter":"simulator","raw_sha256":"3e410c0e4ebd289463ec727c29e6cc588baa94fb15a94200f3ef3ee6cc190a05"},"spec_version":"1.0.0","ts_end":"2026-09-20T09:15:00.000Z","ts_start":"2026-09-20T09:10:00.000Z"},{"dt_s":300,"meters":{"a":{"class":"dc","id":"pzem-017:1","mwh":0},"b":{"class":"dc","id":"epever-tracer:2","mwh":0}},"node_id":"muestra-sim-a","schema_version":"1.1.0","seq":3,"site_id":"muestra-sim","source":{"adapter":"simulator","raw_sha256":"1d1a5e523ee322e60d7712fa98be0f3616e7670122b5f7a5aa14fc46f6b65f00"},"spec_version":"1.0.0","ts_end":"2026-09-20T09:20:00.000Z","ts_start":"2026-09-20T09:15:00.000Z"},{"dt_s":300,"meters":{"a":{"class":"dc","id":"pzem-017:1","mwh":0},"b":{"class":"dc","id":"epever-tracer:2","mwh":0}},"node_id":"muestra-sim-a","schema_version":"1.1.0","seq":4,"site_id":"muestra-sim","source":{"adapter":"simulator","raw_sha256":"aa1863935826f1a354fd645cfeb8d6719dfed5b7d29d7c9b63a764e880d0db6a"},"spec_version":"1.0.0","ts_end":"2026-09-20T09:25:00.000Z","ts_start":"2026-09-20T09:20:00.000Z"},{"dt_s":300,"meters":{"a":{"class":"dc","id":"pzem-017:1","mwh":0},"b":{"class":"dc","id":"epever-tracer:2","mwh":0}},"node_id":"muestra-sim-a","schema_version":"1.1.0","seq":5,"site_id":"muestra-sim","source":{"adapter":"simulator","raw_sha256":"b42683d6ace543700fab405090ebc87751d114a1e1703f10c7130233ab4e686e"},"spec_version":"1.0.0","ts_end":"2026-09-20T09:30:00.000Z","ts_start":"2026-09-20T09:25:00.000Z"},{"dt_s":300,"meters":{"a":{"class":"dc","id":"pzem-017:1","mwh":0},"b":{"class":"dc","id":"epever-tracer:2","mwh":0}},"node_id":"muestra-sim-a","schema_version":"1.1.0","seq":7,"site_id":"muestra-sim","source":{"adapter":"simulator","raw_sha256":"1c96820a9336c10fec0ee0500f1a933fff070a8cb22ad41e10f5efd2a9ddece4"},"spec_version":"1.0.0","ts_end":"2026-09-20T09:40:00.000Z","ts_start":"2026-09-20T09:35:00.000Z"},{"dt_s":300,"meters":{"a":{"class":"dc","id":"pzem-017:1","mwh":0},"b":{"class":"dc","id":"epever-tracer:2","mwh":0}},"node_id":"muestra-sim-a","schema_version":"1.1.0","seq":8,"site_id":"muestra-sim","source":{"adapter":"simulator","raw_sha256":"3a2392063f703a94c5bef29d77084a46a204c90639a7af46dbe7656dfcca7f44"},"spec_version":"1.0.0","ts_end":"2026-09-20T09:45:00.000Z","ts_start":"2026-09-20T09:40:00.000Z"},{"dt_s":300,"meters":{"a":{"class":"dc","id":"pzem-017:1","mwh":0},"b":{"class":"dc","id":"epever-tracer:2","mwh":0}},"node_id":"muestra-sim-a","schema_version":"1.1.0","seq":9,"site_id":"muestra-sim","source":{"adapter":"simulator","raw_sha256":"2f0baa083e257108c16d2e000256846a156bb4ad42bdb1a080ba143439ab5396"},"spec_version":"1.0.0","ts_end":"2026-09-20T09:50:00.000Z","ts_start":"2026-09-20T09:45:00.000Z"},{"dt_s":300,"meters":{"a":{"class":"dc","id":"pzem-017:1","mwh":0},"b":{"class":"dc","id":"epever-tracer:2","mwh":0}},"node_id":"muestra-sim-a","schema_version":"1.1.0","seq":10,"site_id":"muestra-sim","source":{"adapter":"simulator","raw_sha256":"a1aee345f948fc9d7f896a55072bc9e85cb79db3366d40fa357b548e41433dfc"},"spec_version":"1.0.0","ts_end":"2026-09-20T09:55:00.000Z","ts_start":"2026-09-20T09:50:00.000Z"},{"dt_s":300,"meters":{"a":{"class":"dc","id":"pzem-017:1","mwh":0},"b":{"class":"dc","id":"epever-tracer:2","mwh":0}},"node_id":"muestra-sim-a","schema_version":"1.1.0","seq":11,"site_id":"muestra-sim","source":{"adapter":"simulator","raw_sha256":"c3c5cdd431acd11f4943ec2b6f217205ff6bcb70a224370663245d3276550c0e"},"spec_version":"1.0.0","ts_end":"2026-09-20T10:00:00.000Z","ts_start":"2026-09-20T09:55:00.000Z"}],"intervals_root":"7a870c12b446562ff44ee58e05ac40700238165cde6002391679fb35cb1abe46","node_id":"muestra-sim-a","prev_hash":"0000000000000000000000000000000000000000000000000000000000000000","rejected_count":1,"schema_version":"1.1.0","seq":0,"sha256":"69375b2b66627471d84d4e9005225de0abbdaf6cfc63c07fc00c454d0f3917b9","site_id":"muestra-sim","spec_version":"1.0.0","ts_end":"2026-09-20T10:00:00.000Z","ts_start":"2026-09-20T09:00:00.000Z"}
