{"accepted_count":12,"batch_id":"muestra-sim-000001","cumulative_mwh":1128,"energy_mwh":1128,"interval_count":12,"intervals":[{"dt_s":300,"meters":{"a":{"class":"dc","id":"pzem-017:1","mwh":0},"b":{"class":"dc","id":"epever-tracer:2","mwh":0}},"node_id":"muestra-sim-a","schema_version":"1.1.0","seq":12,"site_id":"muestra-sim","source":{"adapter":"simulator","raw_sha256":"3a83d6e62da194117b83bd799195ac70b55706ba132bce3c4d2243cca6e4f4cb"},"spec_version":"1.0.0","ts_end":"2026-09-20T10:05:00.000Z","ts_start":"2026-09-20T10:00:00.000Z"},{"dt_s":300,"meters":{"a":{"class":"dc","id":"pzem-017:1","mwh":0},"b":{"class":"dc","id":"epever-tracer:2","mwh":0}},"node_id":"muestra-sim-a","schema_version":"1.1.0","seq":13,"site_id":"muestra-sim","source":{"adapter":"simulator","raw_sha256":"53c8ba8005886d8e5a76bf83abdaafe54bfa6a6356c33421d41957275c6b0236"},"spec_version":"1.0.0","ts_end":"2026-09-20T10:10:00.000Z","ts_start":"2026-09-20T10:05:00.000Z"},{"dt_s":300,"meters":{"a":{"class":"dc","id":"pzem-017:1","mwh":0},"b":{"class":"dc","id":"epever-tracer:2","mwh":0}},"node_id":"muestra-sim-a","schema_version":"1.1.0","seq":14,"site_id":"muestra-sim","source":{"adapter":"simulator","raw_sha256":"ee0793f1698ae8e6ddcd8ef8d3da3a62c65bcab63b63c78ac6bef2e470e0f7ae"},"spec_version":"1.0.0","ts_end":"2026-09-20T10:15:00.000Z","ts_start":"2026-09-20T10:10:00.000Z"},{"dt_s":300,"meters":{"a":{"class":"dc","id":"pzem-017:1","mwh":0},"b":{"class":"dc","id":"epever-tracer:2","mwh":0}},"node_id":"muestra-sim-a","schema_version":"1.1.0","seq":15,"site_id":"muestra-sim","source":{"adapter":"simulator","raw_sha256":"1ed4f5731b542e6eb4eaf99ee5758fb91d62c5e5e13033a31bd09c30f5c7c399"},"spec_version":"1.0.0","ts_end":"2026-09-20T10:20:00.000Z","ts_start":"2026-09-20T10:15:00.000Z"},{"dt_s":300,"meters":{"a":{"class":"dc","id":"pzem-017:1","mwh":0},"b":{"class":"dc","id":"epever-tracer:2","mwh":0}},"node_id":"muestra-sim-a","schema_version":"1.1.0","seq":16,"site_id":"muestra-sim","source":{"adapter":"simulator","raw_sha256":"471221006e30fe77947272984ce9aa6d2b2823dff9710505f68ca2d23766230b"},"spec_version":"1.0.0","ts_end":"2026-09-20T10:25:00.000Z","ts_start":"2026-09-20T10:20:00.000Z"},{"dt_s":300,"meters":{"a":{"class":"dc","id":"pzem-017:1","mwh":0},"b":{"class":"dc","id":"epever-tracer:2","mwh":0}},"node_id":"muestra-sim-a","schema_version":"1.1.0","seq":17,"site_id":"muestra-sim","source":{"adapter":"simulator","raw_sha256":"889087680dc178fded2587436453fbde1908d0211f1f4273e48deef534596315"},"spec_version":"1.0.0","ts_end":"2026-09-20T10:30:00.000Z","ts_start":"2026-09-20T10:25:00.000Z"},{"dt_s":300,"meters":{"a":{"class":"dc","id":"pzem-017:1","mwh":0},"b":{"class":"dc","id":"epever-tracer:2","mwh":0}},"node_id":"muestra-sim-a","schema_version":"1.1.0","seq":18,"site_id":"muestra-sim","source":{"adapter":"simulator","raw_sha256":"4c43d2edb9333151a0965f3ef331142e97f8d2a1866299310b27b9cdfa2ec251"},"spec_version":"1.0.0","ts_end":"2026-09-20T10:35:00.000Z","ts_start":"2026-09-20T10:30:00.000Z"},{"dt_s":300,"meters":{"a":{"class":"dc","id":"pzem-017:1","mwh":0},"b":{"class":"dc","id":"epever-tracer:2","mwh":0}},"node_id":"muestra-sim-a","schema_version":"1.1.0","seq":19,"site_id":"muestra-sim","source":{"adapter":"simulator","raw_sha256":"ac600c1c1d182234f564f0def312873ecd19155160df031385e9ece124c8aecf"},"spec_version":"1.0.0","ts_end":"2026-09-20T10:40:00.000Z","ts_start":"2026-09-20T10:35:00.000Z"},{"dt_s":300,"meters":{"a":{"class":"dc","id":"pzem-017:1","mwh":93},"b":{"class":"dc","id":"epever-tracer:2","mwh":92}},"node_id":"muestra-sim-a","schema_version":"1.1.0","seq":20,"site_id":"muestra-sim","source":{"adapter":"simulator","raw_sha256":"25cb7a73d20293ab6eaee9a0438e150f8ea2fd7ff26df15b5dcc49cb5d26d5a3"},"spec_version":"1.0.0","ts_end":"2026-09-20T10:45:00.000Z","ts_start":"2026-09-20T10:40:00.000Z"},{"dt_s":300,"meters":{"a":{"class":"dc","id":"pzem-017:1","mwh":214},"b":{"class":"dc","id":"epever-tracer:2","mwh":213}},"node_id":"muestra-sim-a","schema_version":"1.1.0","seq":21,"site_id":"muestra-sim","source":{"adapter":"simulator","raw_sha256":"1daccf72e7ab413c3ffa11922f085c1c0f94a678d4ae436b672fc50a86f7e933"},"spec_version":"1.0.0","ts_end":"2026-09-20T10:50:00.000Z","ts_start":"2026-09-20T10:45:00.000Z"},{"dt_s":300,"meters":{"a":{"class":"dc","id":"pzem-017:1","mwh":346},"b":{"class":"dc","id":"epever-tracer:2","mwh":343}},"node_id":"muestra-sim-a","schema_version":"1.1.0","seq":22,"site_id":"muestra-sim","source":{"adapter":"simulator","raw_sha256":"5e09cd088d6b2929759f599bceb0c2a9f3c8cf8d5a2625d175ffc6ee954410d0"},"spec_version":"1.0.0","ts_end":"2026-09-20T10:55:00.000Z","ts_start":"2026-09-20T10:50:00.000Z"},{"dt_s":300,"meters":{"a":{"class":"dc","id":"pzem-017:1","mwh":484},"b":{"class":"dc","id":"epever-tracer:2","mwh":480}},"node_id":"muestra-sim-a","schema_version":"1.1.0","seq":23,"site_id":"muestra-sim","source":{"adapter":"simulator","raw_sha256":"a010e8b7e1a4900fc9d64e13006b14d5ecf25e2d3105039a4d4c614a8b3a78f6"},"spec_version":"1.0.0","ts_end":"2026-09-20T11:00:00.000Z","ts_start":"2026-09-20T10:55:00.000Z"}],"intervals_root":"f2a397606b88ee7e35a5932450248e217ec910a4abcaa3270b66a291a213398b","node_id":"muestra-sim-a","prev_hash":"69375b2b66627471d84d4e9005225de0abbdaf6cfc63c07fc00c454d0f3917b9","rejected_count":0,"schema_version":"1.1.0","seq":1,"sha256":"8fcb67d4d3bb15f97f302abc22ed054cf33684807d3b9e8373b117265788b593","site_id":"muestra-sim","spec_version":"1.0.0","ts_end":"2026-09-20T11:00:00.000Z","ts_start":"2026-09-20T10:00:00.000Z"}
