{"accepted_count":12,"batch_id":"muestra-sim-000005","cumulative_mwh":192283,"energy_mwh":79563,"interval_count":13,"intervals":[{"dt_s":300,"meters":{"a":{"class":"dc","id":"pzem-017:1","mwh":6083},"b":{"class":"dc","id":"epever-tracer:2","mwh":6035}},"node_id":"muestra-sim-a","schema_version":"1.1.0","seq":61,"site_id":"muestra-sim","source":{"adapter":"simulator","raw_sha256":"73e25f75dcc4f144608a0b8344aea8fc443612a0587246750a7f1457e7fe9fb0"},"spec_version":"1.0.0","ts_end":"2026-09-20T14:05:00.000Z","ts_start":"2026-09-20T14:00:00.000Z"},{"dt_s":300,"meters":{"a":{"class":"dc","id":"pzem-017:1","mwh":6204},"b":{"class":"dc","id":"epever-tracer:2","mwh":6154}},"node_id":"muestra-sim-a","schema_version":"1.1.0","seq":62,"site_id":"muestra-sim","source":{"adapter":"simulator","raw_sha256":"1168f75324c19c8bc576264e23fc9813dcfdc960be2f696d623c061ce22ed8ce"},"spec_version":"1.0.0","ts_end":"2026-09-20T14:10:00.000Z","ts_start":"2026-09-20T14:05:00.000Z"},{"dt_s":300,"meters":{"a":{"class":"dc","id":"pzem-017:1","mwh":6321},"b":{"class":"dc","id":"epever-tracer:2","mwh":6270}},"node_id":"muestra-sim-a","schema_version":"1.1.0","seq":63,"site_id":"muestra-sim","source":{"adapter":"simulator","raw_sha256":"947f438bcb0438c24f126aa2d696623986292dc28cce702b9aaf0c23f736b105"},"spec_version":"1.0.0","ts_end":"2026-09-20T14:15:00.000Z","ts_start":"2026-09-20T14:10:00.000Z"},{"dt_s":300,"meters":{"a":{"class":"dc","id":"pzem-017:1","mwh":6435},"b":{"class":"dc","id":"epever-tracer:2","mwh":6383}},"node_id":"muestra-sim-a","schema_version":"1.1.0","seq":64,"site_id":"muestra-sim","source":{"adapter":"simulator","raw_sha256":"185835f05756a779580f4957b82797ca6da4016a1e7fbca6183601a545519e0e"},"spec_version":"1.0.0","ts_end":"2026-09-20T14:20:00.000Z","ts_start":"2026-09-20T14:15:00.000Z"},{"dt_s":300,"meters":{"a":{"class":"dc","id":"pzem-017:1","mwh":6545},"b":{"class":"dc","id":"epever-tracer:2","mwh":6493}},"node_id":"muestra-sim-a","schema_version":"1.1.0","seq":65,"site_id":"muestra-sim","source":{"adapter":"simulator","raw_sha256":"859fa1b2a42abe4cb24ff6373f20f386bca0bba069ab0647735431e91e54dab5"},"spec_version":"1.0.0","ts_end":"2026-09-20T14:25:00.000Z","ts_start":"2026-09-20T14:20:00.000Z"},{"dt_s":300,"meters":{"a":{"class":"dc","id":"pzem-017:1","mwh":6652},"b":{"class":"dc","id":"epever-tracer:2","mwh":6599}},"node_id":"muestra-sim-a","schema_version":"1.1.0","seq":66,"site_id":"muestra-sim","source":{"adapter":"simulator","raw_sha256":"7cd3919269c5a383191933eebee70c257a0c7c2858fc60251637c30eb86910b3"},"spec_version":"1.0.0","ts_end":"2026-09-20T14:30:00.000Z","ts_start":"2026-09-20T14:25:00.000Z"},{"dt_s":300,"meters":{"a":{"class":"dc","id":"pzem-017:1","mwh":6756},"b":{"class":"dc","id":"epever-tracer:2","mwh":6702}},"node_id":"muestra-sim-a","schema_version":"1.1.0","seq":67,"site_id":"muestra-sim","source":{"adapter":"simulator","raw_sha256":"e188b3e8193695c377efaf6be8ec3b210f6f9ed8c18bb521e8ef5595352163ea"},"spec_version":"1.0.0","ts_end":"2026-09-20T14:35:00.000Z","ts_start":"2026-09-20T14:30:00.000Z"},{"dt_s":300,"meters":{"a":{"class":"dc","id":"pzem-017:1","mwh":6856},"b":{"class":"dc","id":"epever-tracer:2","mwh":6801}},"node_id":"muestra-sim-a","schema_version":"1.1.0","seq":68,"site_id":"muestra-sim","source":{"adapter":"simulator","raw_sha256":"d42d419cb6a566db73ab1b32b65ee5302e81bad666e231124688d045f964b29a"},"spec_version":"1.0.0","ts_end":"2026-09-20T14:40:00.000Z","ts_start":"2026-09-20T14:35:00.000Z"},{"dt_s":300,"meters":{"a":{"class":"dc","id":"pzem-017:1","mwh":6953},"b":{"class":"dc","id":"epever-tracer:2","mwh":6897}},"node_id":"muestra-sim-a","schema_version":"1.1.0","seq":69,"site_id":"muestra-sim","source":{"adapter":"simulator","raw_sha256":"c26e608e6021ceffa973dc735710dd30505afaf19a9e9feb4846a8be77bd2467"},"spec_version":"1.0.0","ts_end":"2026-09-20T14:45:00.000Z","ts_start":"2026-09-20T14:40:00.000Z"},{"dt_s":300,"meters":{"a":{"class":"dc","id":"pzem-017:1","mwh":7045},"b":{"class":"dc","id":"epever-tracer:2","mwh":6989}},"node_id":"muestra-sim-a","schema_version":"1.1.0","seq":70,"site_id":"muestra-sim","source":{"adapter":"simulator","raw_sha256":"ca4fca907073998fa7a5c34f9feea15162fc0cc4506f3503110635d1b661f002"},"spec_version":"1.0.0","ts_end":"2026-09-20T14:50:00.000Z","ts_start":"2026-09-20T14:45:00.000Z"},{"dt_s":300,"meters":{"a":{"class":"dc","id":"pzem-017:1","mwh":7135},"b":{"class":"dc","id":"epever-tracer:2","mwh":7078}},"node_id":"muestra-sim-a","schema_version":"1.1.0","seq":71,"site_id":"muestra-sim","source":{"adapter":"simulator","raw_sha256":"4c7fc17bd59f754982c581b6544ef24239d31bec49a5a10fb9ccebad31714a68"},"spec_version":"1.0.0","ts_end":"2026-09-20T14:55:00.000Z","ts_start":"2026-09-20T14:50:00.000Z"},{"dt_s":300,"meters":{"a":{"class":"dc","id":"pzem-017:1","mwh":7220},"b":{"class":"dc","id":"epever-tracer:2","mwh":7162}},"node_id":"muestra-sim-a","schema_version":"1.1.0","seq":72,"site_id":"muestra-sim","source":{"adapter":"simulator","raw_sha256":"6144281d017c4bea40455c5de5c96b37d0a719d2c7bb2c29f17f10916e434094"},"spec_version":"1.0.0","ts_end":"2026-09-20T15:00:00.000Z","ts_start":"2026-09-20T14:55:00.000Z"}],"intervals_root":"803ecaf595dc1eb025fa4e8b48b4ba54ac2a33f98473eb6eab5686b1f43ee39a","node_id":"muestra-sim-a","prev_hash":"df4cd36db7fe9659e7fdd0360aedb1f871a1f69857711dbe70dd1e7548ed6e80","rejected_count":1,"schema_version":"1.1.0","seq":5,"sha256":"2365de2262acb3d1ec17cc4ed43f4ce134df2189daabcf09a3516081717c0dc5","site_id":"muestra-sim","spec_version":"1.0.0","ts_end":"2026-09-20T15:00:00.000Z","ts_start":"2026-09-20T14:00:00.000Z"}
